texto,estrellas,fecha_analisis,sentimiento,confianza
"La notebook está bien, la pantalla no tiene buena calidad de imagen. Para un uso cotidiano está bien y corre bien programas como ableton, cubase, etc. Es liviana y estéticamente es minimalista. Es completamente de plástico y al tacto se siente bien. El pad es grande y cumple su funcion correctamente.",3,2025-04-26 09:11:00,NEUTRO,71%
"La verdad es que es una bomba. Aparte la uso para la universidad y no para el gaming, la capacidad para captar internet es abismal, estoy super lejos y lo agarro igual. No sé me traba pero de vez en cuando veo alguna cuestión como una travadita pero aceptable. Manda camara y lo único malo, no tiene micrófono (creo), pero el resto está de perlas.
Manso volumen (estaría bueno que tenga más bajos) y definitivamente la batería es de 4 horas aprox. Ahí baja bastante.
Más al tiempo vuelvo con la calidad.",2,2025-04-26 09:11:00,NEGATIVO,55%
"Muy buena, muchísimas gracias.",5,2025-04-26 09:11:00,POSITIVO,82%
"La notebook es muy buena considerando el precio, lo mejor es su velocidad, para tareas de oficina va re bien. Lo peor tal vez es la calidad de imagen, no es la mejor pantalla pero es entendible. No es muy pesada, los materiales de lo que está hecha la notebook se ven duraderos y el diseño general del equipo es muy lindo.",4,2025-04-26 09:11:00,POSITIVO,57%
"Muy buena la compu,.",5,2025-04-26 09:11:00,POSITIVO,70%
